{
  "acquisition_run_id": "run-20261015T175844Z-57440372",
  "acquisition_status": "succeeded",
  "artifact": {
    "byte_length": 27558,
    "declared_media_type": "text/xml",
    "detected_media_type": "application/xml",
    "relative_path": "raw/federal-register/2020-05711/run-20261015T175844Z-57440372/full-text.xml",
    "sha256": "97bc9c2d8b80d8b2607a2feec915d453972927165bb34de4bf3c54182f70ffb5"
  },
  "authority_role": "structured_parsing_input",
  "receipt_id": "receipt-20261015T175946Z-e4cd4ba7",
  "redistribution": {
    "basis": "U.S. Government work, 17 U.S.C. 105; GovInfo policy permits reprinting with credit to the issuing agency (FAA). See REDISTRIBUTION.md.",
    "status": "permitted"
  },
  "representation_role": "full_text_xml",
  "request": {
    "method": "GET",
    "requested_url": "https://www.federalregister.gov/documents/full_text/xml/2020/03/20/2020-05711.xml",
    "resolved_url": "https://www.federalregister.gov/documents/full_text/xml/2020/03/20/2020-05711.xml"
  },
  "response": {
    "headers": {
      "content_length": 27558,
      "content_type": "text/xml",
      "last_modified": "Thu, 30 May 2024 19:31:07 GMT"
    },
    "status_code": 200
  },
  "retrieval_id": "retrieval-20261015T175946Z-e4cd4ba7",
  "retrieved_at_utc": "2026-10-15T17:59:47Z",
  "schema_version": "1.0.0",
  "source_document_identity": {
    "namespace": "federal_register_document_number",
    "value": "2020-05711"
  },
  "source_system": "federal_register"
}
