{
  "acquisition_run_id": "run-20260926T215105Z-7fe9da08",
  "acquisition_status": "succeeded",
  "artifact": {
    "byte_length": 6070,
    "declared_media_type": "application/json",
    "detected_media_type": "application/json",
    "relative_path": "raw/federal-register/2021-14268/run-20260926T215105Z-7fe9da08/api.json",
    "sha256": "7b79a888ab0606646af6934dee19ebc9d784b7a92182030cf993095a3bbc42e8"
  },
  "authority_role": "discovery_metadata",
  "receipt_id": "receipt-20260926T215114Z-d56a9cb5",
  "redistribution": {
    "basis": "U.S. Government work, 17 U.S.C. 105; GovInfo policy permits reprinting with credit to the issuing agency (FAA). See REDISTRIBUTION.md.",
    "status": "permitted"
  },
  "representation_role": "api_json",
  "request": {
    "method": "GET",
    "requested_url": "https://www.federalregister.gov/api/v1/documents/2021-14268.json",
    "resolved_url": "https://www.federalregister.gov/api/v1/documents/2021-14268.json"
  },
  "response": {
    "headers": {
      "content_length": 6070,
      "content_type": "application/json; charset=utf-8"
    },
    "status_code": 200
  },
  "retrieval_id": "retrieval-20260926T215114Z-d56a9cb5",
  "retrieved_at_utc": "2026-09-26T21:51:14Z",
  "schema_version": "1.0.0",
  "source_document_identity": {
    "namespace": "federal_register_document_number",
    "value": "2021-14268"
  },
  "source_system": "federal_register"
}
