{
  "acquisition_run_id": "run-20261011T165831Z-6cea777a",
  "acquisition_status": "succeeded",
  "artifact": {
    "byte_length": 37177,
    "declared_media_type": "text/html",
    "detected_media_type": "application/xml",
    "relative_path": "raw/federal-register/2021-11960/run-20261011T165831Z-6cea777a/full-text.html",
    "sha256": "240fe6da4ca67edb02308041a5c41e8997ba06740781c80d500bd516cf6a5a50"
  },
  "authority_role": "evidence_projection",
  "receipt_id": "receipt-20261011T165931Z-c44af11c",
  "redistribution": {
    "basis": "U.S. Government work, 17 U.S.C. 105; GovInfo policy permits reprinting with credit to the issuing agency (FAA). See REDISTRIBUTION.md.",
    "status": "permitted"
  },
  "representation_role": "full_text_html",
  "request": {
    "method": "GET",
    "requested_url": "https://www.federalregister.gov/documents/full_text/html/2021/06/08/2021-11960.html",
    "resolved_url": "https://www.federalregister.gov/documents/full_text/html/2021/06/08/2021-11960.html"
  },
  "response": {
    "headers": {
      "content_length": 37177,
      "content_type": "text/html",
      "last_modified": "Tue, 02 Sep 2025 10:51:40 GMT"
    },
    "status_code": 200
  },
  "retrieval_id": "retrieval-20261011T165931Z-c44af11c",
  "retrieved_at_utc": "2026-10-11T16:59:33Z",
  "schema_version": "1.0.0",
  "source_document_identity": {
    "namespace": "federal_register_document_number",
    "value": "2021-11960"
  },
  "source_system": "federal_register"
}
