{
  "acquisition_run_id": "run-20261011T165831Z-6cea777a",
  "acquisition_status": "succeeded",
  "artifact": {
    "byte_length": 14608,
    "declared_media_type": "text/xml",
    "detected_media_type": "application/xml",
    "relative_path": "raw/federal-register/2013-08448/run-20261011T165831Z-6cea777a/full-text.xml",
    "sha256": "f65ff08795a25b75c737715447b91170a140e57ae87ca7a2e6749ae85df62323"
  },
  "authority_role": "structured_parsing_input",
  "receipt_id": "receipt-20261011T165841Z-fb22b4a3",
  "redistribution": {
    "basis": "U.S. Government work, 17 U.S.C. 105; GovInfo policy permits reprinting with credit to the issuing agency (FAA). See REDISTRIBUTION.md.",
    "status": "permitted"
  },
  "representation_role": "full_text_xml",
  "request": {
    "method": "GET",
    "requested_url": "https://www.federalregister.gov/documents/full_text/xml/2013/04/15/2013-08448.xml",
    "resolved_url": "https://www.federalregister.gov/documents/full_text/xml/2013/04/15/2013-08448.xml"
  },
  "response": {
    "headers": {
      "content_length": 14608,
      "content_type": "text/xml",
      "last_modified": "Mon, 03 Jun 2024 22:54:11 GMT"
    },
    "status_code": 200
  },
  "retrieval_id": "retrieval-20261011T165841Z-fb22b4a3",
  "retrieved_at_utc": "2026-10-11T16:58:41Z",
  "schema_version": "1.0.0",
  "source_document_identity": {
    "namespace": "federal_register_document_number",
    "value": "2013-08448"
  },
  "source_system": "federal_register"
}
