{
  "acquisition_run_id": "run-20261015T175844Z-57440372",
  "acquisition_status": "succeeded",
  "artifact": {
    "byte_length": 18492,
    "declared_media_type": "text/xml",
    "detected_media_type": "application/xml",
    "relative_path": "raw/federal-register/2021-19600/run-20261015T175844Z-57440372/full-text.xml",
    "sha256": "f70a0effe57b9c633bfb8144484f98a34e5d9175efb7d90c57e5169eed7e1fac"
  },
  "authority_role": "structured_parsing_input",
  "receipt_id": "receipt-20261015T175953Z-f5c2f295",
  "redistribution": {
    "basis": "U.S. Government work, 17 U.S.C. 105; GovInfo policy permits reprinting with credit to the issuing agency (FAA). See REDISTRIBUTION.md.",
    "status": "permitted"
  },
  "representation_role": "full_text_xml",
  "request": {
    "method": "GET",
    "requested_url": "https://www.federalregister.gov/documents/full_text/xml/2021/09/10/2021-19600.xml",
    "resolved_url": "https://www.federalregister.gov/documents/full_text/xml/2021/09/10/2021-19600.xml"
  },
  "response": {
    "headers": {
      "content_length": 18492,
      "content_type": "text/xml",
      "last_modified": "Sat, 16 Sep 2023 05:14:22 GMT"
    },
    "status_code": 200
  },
  "retrieval_id": "retrieval-20261015T175953Z-f5c2f295",
  "retrieved_at_utc": "2026-10-15T17:59:53Z",
  "schema_version": "1.0.0",
  "source_document_identity": {
    "namespace": "federal_register_document_number",
    "value": "2021-19600"
  },
  "source_system": "federal_register"
}
