{
  "acquisition_run_id": "run-20261011T165831Z-6cea777a",
  "acquisition_status": "succeeded",
  "artifact": {
    "byte_length": 19816,
    "declared_media_type": "text/xml",
    "detected_media_type": "application/xml",
    "relative_path": "raw/federal-register/2018-24239/run-20261011T165831Z-6cea777a/full-text.xml",
    "sha256": "8e4c4981f4015f32fc62f75510631f7bcc559eb334b662ad4fa75cac775643ab"
  },
  "authority_role": "structured_parsing_input",
  "receipt_id": "receipt-20261011T165847Z-16a60734",
  "redistribution": {
    "basis": "U.S. Government work, 17 U.S.C. 105; GovInfo policy permits reprinting with credit to the issuing agency (FAA). See REDISTRIBUTION.md.",
    "status": "permitted"
  },
  "representation_role": "full_text_xml",
  "request": {
    "method": "GET",
    "requested_url": "https://www.federalregister.gov/documents/full_text/xml/2018/11/07/2018-24239.xml",
    "resolved_url": "https://www.federalregister.gov/documents/full_text/xml/2018/11/07/2018-24239.xml"
  },
  "response": {
    "headers": {
      "content_length": 19816,
      "content_type": "text/xml",
      "last_modified": "Thu, 06 Feb 2020 23:07:45 GMT"
    },
    "status_code": 200
  },
  "retrieval_id": "retrieval-20261011T165847Z-16a60734",
  "retrieved_at_utc": "2026-10-11T16:58:47Z",
  "schema_version": "1.0.0",
  "source_document_identity": {
    "namespace": "federal_register_document_number",
    "value": "2018-24239"
  },
  "source_system": "federal_register"
}
