{
  "acquisition_run_id": "run-20261011T165831Z-6cea777a",
  "acquisition_status": "succeeded",
  "artifact": {
    "byte_length": 24128,
    "declared_media_type": "image/png",
    "detected_media_type": "image/png",
    "relative_path": "raw/federal-register/2019-01127/run-20261011T165831Z-6cea777a/figures/ER08FE19.004_original.png",
    "sha256": "5e4ce587e1205f1e4a3eb917af1d5be5615c87308a8b78ae89928ff86efc2415"
  },
  "authority_role": "document_graphic",
  "parent_document_identity": {
    "namespace": "federal_register_document_number",
    "value": "2019-01127"
  },
  "receipt_id": "receipt-20261011T165858Z-9976d2de",
  "redistribution": {
    "basis": "Document graphics may reproduce third-party copyrighted material; reviewed per document. See REDISTRIBUTION.md.",
    "status": "review_required"
  },
  "representation_role": "original_graphic",
  "request": {
    "method": "GET",
    "requested_url": "https://img.federalregister.gov/ER08FE19.004/ER08FE19.004_original_size.png",
    "resolved_url": "https://img.federalregister.gov/ER08FE19.004/ER08FE19.004_original_size.png"
  },
  "response": {
    "headers": {
      "content_length": 24128,
      "content_type": "image/png",
      "etag": "\"cbf1b9df49c4d68069b0820ae0b4e5cd\"",
      "last_modified": "Fri, 20 May 2022 01:27:19 GMT"
    },
    "status_code": 200
  },
  "retrieval_id": "retrieval-20261011T165858Z-9976d2de",
  "retrieved_at_utc": "2026-10-11T16:58:58Z",
  "schema_version": "1.0.0",
  "source_document_identity": {
    "namespace": "federal_register_document_number",
    "value": "2019-01127"
  },
  "source_graphic_identifier": "ER08FE19.004",
  "source_system": "federal_register"
}
