{
  "acquisition_run_id": "run-20260926T213233Z-000f808f",
  "acquisition_status": "succeeded",
  "artifact": {
    "byte_length": 11653,
    "declared_media_type": "text/xml",
    "detected_media_type": "application/xml",
    "relative_path": "raw/govinfo/2025-10764/run-20260926T213233Z-000f808f/mods.xml",
    "sha256": "f2fddd8ae7c482f63ded5eccb216583601598e7359f1b75dea6298f72c0d56cd"
  },
  "authority_role": "bibliographic_metadata",
  "parent_document_identity": {
    "namespace": "federal_register_document_number",
    "value": "2025-10764"
  },
  "receipt_id": "receipt-20260926T213234Z-1d4d5b09",
  "redistribution": {
    "basis": "Federal Register publication of a U.S. Government work; retention and redistribution decision pending the Reproducible checkpoint review.",
    "status": "review_required"
  },
  "representation_role": "mods_xml",
  "request": {
    "method": "GET",
    "requested_url": "https://www.govinfo.gov/metadata/granule/FR-2025-06-13/2025-10764/mods.xml",
    "resolved_url": "https://www.govinfo.gov/metadata/granule/FR-2025-06-13/2025-10764/mods.xml"
  },
  "response": {
    "headers": {
      "content_disposition": "inline; filename=\"mods.xml\"",
      "content_type": "text/xml;charset=UTF-8"
    },
    "status_code": 200
  },
  "retrieval_id": "retrieval-20260926T213234Z-1d4d5b09",
  "retrieved_at_utc": "2026-09-26T21:32:34Z",
  "schema_version": "1.0.0",
  "source_document_identity": {
    "namespace": "govinfo_package_granule",
    "value": "FR-2025-06-13/2025-10764"
  },
  "source_system": "govinfo"
}
