{
  "acquisition_run_id": "run-20261011T165831Z-6cea777a",
  "acquisition_status": "succeeded",
  "artifact": {
    "byte_length": 7064,
    "declared_media_type": "application/json",
    "detected_media_type": "application/json",
    "relative_path": "raw/federal-register/2015-12068/run-20261011T165831Z-6cea777a/api.json",
    "sha256": "ee8de65fdc79a44b9943ba179c774b9543c73f40c2d7c08eae89b5297b4e801f"
  },
  "authority_role": "discovery_metadata",
  "receipt_id": "receipt-20261011T165841Z-5e35a948",
  "redistribution": {
    "basis": "U.S. Government work, 17 U.S.C. 105; GovInfo policy permits reprinting with credit to the issuing agency (FAA). See REDISTRIBUTION.md.",
    "status": "permitted"
  },
  "representation_role": "api_json",
  "request": {
    "method": "GET",
    "requested_url": "https://www.federalregister.gov/api/v1/documents/2015-12068.json",
    "resolved_url": "https://www.federalregister.gov/api/v1/documents/2015-12068.json"
  },
  "response": {
    "headers": {
      "content_length": 7064,
      "content_type": "application/json; charset=utf-8"
    },
    "status_code": 200
  },
  "retrieval_id": "retrieval-20261011T165841Z-5e35a948",
  "retrieved_at_utc": "2026-10-11T16:58:41Z",
  "schema_version": "1.0.0",
  "source_document_identity": {
    "namespace": "federal_register_document_number",
    "value": "2015-12068"
  },
  "source_system": "federal_register"
}
