{
  "acquisition_run_id": "run-20261015T175844Z-57440372",
  "acquisition_status": "succeeded",
  "artifact": {
    "byte_length": 8273,
    "declared_media_type": "application/json",
    "detected_media_type": "application/json",
    "relative_path": "raw/federal-register/2018-24250/run-20261015T175844Z-57440372/api.json",
    "sha256": "08a24a8a3589a684660c93720d5c3bdde5b3288a1cde4e0dea87f688a6f16c39"
  },
  "authority_role": "discovery_metadata",
  "receipt_id": "receipt-20261015T175933Z-277e6077",
  "redistribution": {
    "basis": "U.S. Government work, 17 U.S.C. 105; GovInfo policy permits reprinting with credit to the issuing agency (FAA). See REDISTRIBUTION.md.",
    "status": "permitted"
  },
  "representation_role": "api_json",
  "request": {
    "method": "GET",
    "requested_url": "https://www.federalregister.gov/api/v1/documents/2018-24250.json",
    "resolved_url": "https://www.federalregister.gov/api/v1/documents/2018-24250.json"
  },
  "response": {
    "headers": {
      "content_length": 8273,
      "content_type": "application/json; charset=utf-8"
    },
    "status_code": 200
  },
  "retrieval_id": "retrieval-20261015T175933Z-277e6077",
  "retrieved_at_utc": "2026-10-15T17:59:33Z",
  "schema_version": "1.0.0",
  "source_document_identity": {
    "namespace": "federal_register_document_number",
    "value": "2018-24250"
  },
  "source_system": "federal_register"
}
